[
  {
    "id":"J5-MAR-SLB-09-missed-yellow-igor",
    "season":"2026/27",
    "competition":"Liga Portugal",
    "round":5,
    "date":"2026-09-05",
    "home_team":"CS Marítimo",
    "away_team":"SL Benfica",
    "referee":"Sérgio Guelho",
    "var":"Manuel Oliveira",
    "minute":"9",
    "category":"missed_yellow",
    "impact_class":"disciplinary_secondary",
    "on_field_decision":"No yellow to Igor Julião after challenge on Prestianni",
    "correct_decision":"Candidate yellow to Igor Julião",
    "error_direction":"against",
    "tracked_club":"SL Benfica",
    "status":"candidate",
    "var_relevant":false,
    "result_impact":"discipline_only",
    "sources":[
      {"source_id":"verdade-desportiva","tier":"C_MATCH_EVIDENCE","url":"https://verdadedesportiva.pt/lances/1e42cc29-b0bc-42d6-8096-5d7665368462","conclusion":"error","notes":"The match's current incident list classifies the minute-9 Igor Julião challenge as an error, but the exact named-expert provenance for this incident was not independently recovered in this sweep."}
    ],
    "notes":"Kept candidate under the strict S360 threshold; excluded from public totals until named expert/official provenance is captured.",
    "verified_at":"2026-09-06T23:35:00+01:00"
  },
  {
    "id":"J5-MAR-SLB-22-missed-yellow-tomas-araujo",
    "season":"2026/27",
    "competition":"Liga Portugal",
    "round":5,
    "date":"2026-09-05",
    "home_team":"CS Marítimo",
    "away_team":"SL Benfica",
    "referee":"Sérgio Guelho",
    "var":"Manuel Oliveira",
    "minute":"22",
    "category":"missed_yellow",
    "impact_class":"disciplinary_secondary",
    "on_field_decision":"Direct free kick, no yellow to Tomás Araújo",
    "correct_decision":"Yellow to Tomás Araújo for the tactical challenge",
    "error_direction":"favor",
    "tracked_club":"SL Benfica",
    "status":"confirmed",
    "var_relevant":false,
    "result_impact":"discipline_only",
    "sources":[
      {"source_id":"marco-ferreira-record","tier":"B_EX_REFEREE","url":"https://verdadedesportiva.pt/lances/1e42cc29-b0bc-42d6-8096-5d7665368462","conclusion":"error","notes":"Record analysis quoted on the incident page."},
      {"source_id":"jorge-faustino-record","tier":"B_EX_REFEREE","url":"https://verdadedesportiva.pt/lances/1e42cc29-b0bc-42d6-8096-5d7665368462","conclusion":"error","notes":"Record analysis quoted on the incident page."},
      {"source_id":"jorge-coroado-ojogo","tier":"B_EX_REFEREE","url":"https://verdadedesportiva.pt/lances/1e42cc29-b0bc-42d6-8096-5d7665368462","conclusion":"error","notes":"O JOGO analysis quoted on the incident page."},
      {"source_id":"jose-leiros-ojogo","tier":"B_EX_REFEREE","url":"https://verdadedesportiva.pt/lances/1e42cc29-b0bc-42d6-8096-5d7665368462","conclusion":"error","notes":"O JOGO analysis quoted on the incident page."},
      {"source_id":"fortunato-azevedo-ojogo","tier":"B_EX_REFEREE","url":"https://verdadedesportiva.pt/lances/1e42cc29-b0bc-42d6-8096-5d7665368462","conclusion":"correct","notes":"Minority view: technical foul only, no disciplinary sanction."},
      {"source_id":"verdade-desportiva","tier":"C_MATCH_EVIDENCE","url":"https://verdadedesportiva.pt/lances/1e42cc29-b0bc-42d6-8096-5d7665368462","conclusion":"error"}
    ],
    "notes":"4-1 former-referee majority. Confirmed despite one contrary opinion because at least two independent former referees agree on the error.",
    "verified_at":"2026-09-06T23:35:00+01:00"
  },
  {
    "id":"J5-SCP-NAC-16-missed-yellow-pablo-ruan",
    "season":"2026/27",
    "competition":"Liga Portugal",
    "round":5,
    "date":"2026-09-05",
    "home_team":"Sporting CP",
    "away_team":"CD Nacional",
    "referee":"João Pinheiro",
    "var":"Pedro Ferreira",
    "minute":"16",
    "category":"missed_yellow",
    "impact_class":"disciplinary_secondary",
    "on_field_decision":"No yellow to Pablo Ruan",
    "correct_decision":"Yellow to Pablo Ruan",
    "error_direction":"against",
    "tracked_club":"Sporting CP",
    "status":"confirmed",
    "var_relevant":false,
    "result_impact":"discipline_only",
    "sources":[
      {"source_id":"jose-leiros-ojogo","tier":"B_EX_REFEREE","url":"https://verdadedesportiva.pt/lances/7e50fe3c-ca98-442e-995b-96623848598e","conclusion":"error","notes":"O JOGO analysis quoted on the incident page."},
      {"source_id":"fortunato-azevedo-ojogo","tier":"B_EX_REFEREE","url":"https://verdadedesportiva.pt/lances/7e50fe3c-ca98-442e-995b-96623848598e","conclusion":"error","notes":"O JOGO analysis quoted on the incident page."},
      {"source_id":"jorge-coroado-ojogo","tier":"B_EX_REFEREE","url":"https://verdadedesportiva.pt/lances/7e50fe3c-ca98-442e-995b-96623848598e","conclusion":"correct","notes":"Minority view: no yellow required."},
      {"source_id":"verdade-desportiva","tier":"C_MATCH_EVIDENCE","url":"https://verdadedesportiva.pt/lances/7e50fe3c-ca98-442e-995b-96623848598e","conclusion":"error"}
    ],
    "notes":"Two former referees support yellow; one disagrees. Meets the S360 two-ex-referee confirmation rule.",
    "verified_at":"2026-09-06T23:35:00+01:00"
  },
  {
    "id":"J5-SCP-NAC-31-missed-yellow-leo-santos",
    "season":"2026/27",
    "competition":"Liga Portugal",
    "round":5,
    "date":"2026-09-05",
    "home_team":"Sporting CP",
    "away_team":"CD Nacional",
    "referee":"João Pinheiro",
    "var":"Pedro Ferreira",
    "minute":"31",
    "category":"missed_yellow",
    "impact_class":"disciplinary_secondary",
    "on_field_decision":"Penalty to Sporting, no yellow to Leo Santos",
    "correct_decision":"Penalty plus yellow to Leo Santos",
    "error_direction":"against",
    "tracked_club":"Sporting CP",
    "status":"confirmed",
    "var_relevant":false,
    "result_impact":"discipline_only",
    "sources":[
      {"source_id":"pedro-henriques-abola","tier":"B_EX_REFEREE","url":"https://www.abola.pt/noticias/a-analise-de-pedro-henriques-a-arbitragem-do-sporting-nacional-2026090523241527223","conclusion":"error"},
      {"source_id":"verdade-desportiva","tier":"C_MATCH_EVIDENCE","url":"https://verdadedesportiva.pt/lances/e2ef18bd-b388-459a-b819-86751d32b641","conclusion":"error"},
      {"source_id":"vsports-liga","tier":"C_MATCH_EVIDENCE","url":"https://rr.vsports.pt/","conclusion":"unclear","notes":"Video evidence supports incident traceability; interpretative conclusion comes from the named former referee."}
    ],
    "notes":"The penalty itself was correctly awarded; the confirmed error is only the omitted yellow.",
    "verified_at":"2026-09-06T23:35:00+01:00"
  },
  {
    "id":"J5-SCP-NAC-53-contact-geny-disputed",
    "season":"2026/27",
    "competition":"Liga Portugal",
    "round":5,
    "date":"2026-09-05",
    "home_team":"Sporting CP",
    "away_team":"CD Nacional",
    "referee":"João Pinheiro",
    "var":"Pedro Ferreira",
    "minute":"53",
    "category":"technical_other",
    "impact_class":"disciplinary_secondary",
    "on_field_decision":"Play continued; no penalty or free kick",
    "correct_decision":"Disputed: direct free kick outside the area plus yellow versus no foul",
    "error_direction":"disputed",
    "tracked_club":"Sporting CP",
    "status":"disputed",
    "var_relevant":true,
    "result_impact":"none",
    "sources":[
      {"source_id":"jorge-faustino-record","tier":"B_EX_REFEREE","url":"https://verdadedesportiva.pt/lances/bc28b8df-8d14-4823-af31-fcf136ec01af","conclusion":"error","notes":"Concludes foul outside the area plus yellow."},
      {"source_id":"tiago-antunes-rr","tier":"C_MATCH_EVIDENCE","url":"https://rr.pt/bola-branca/noticia/amp/futebol-nacional/2026/09/05/nota-4-para-joao-pinheiro-penalti-bem-assinalado/484414/","conclusion":"correct","notes":"Concludes there was no foul."},
      {"source_id":"verdade-desportiva","tier":"C_MATCH_EVIDENCE","url":"https://verdadedesportiva.pt/lances/bc28b8df-8d14-4823-af31-fcf136ec01af","conclusion":"unclear"}
    ],
    "notes":"Explicit source conflict. Excluded from public totals. Both views agree it was not a penalty; disagreement is whether an outside-area foul and yellow were required.",
    "verified_at":"2026-09-06T23:35:00+01:00"
  },
  {
    "id":"J5-SCP-NAC-59-missed-yellow-geny",
    "season":"2026/27",
    "competition":"Liga Portugal",
    "round":5,
    "date":"2026-09-05",
    "home_team":"Sporting CP",
    "away_team":"CD Nacional",
    "referee":"João Pinheiro",
    "var":"Pedro Ferreira",
    "minute":"59",
    "category":"missed_yellow",
    "impact_class":"disciplinary_secondary",
    "on_field_decision":"No yellow to Geny Catamo",
    "correct_decision":"Yellow to Geny Catamo",
    "error_direction":"favor",
    "tracked_club":"Sporting CP",
    "status":"confirmed",
    "var_relevant":false,
    "result_impact":"discipline_only",
    "sources":[
      {"source_id":"marco-ferreira-record","tier":"B_EX_REFEREE","url":"https://verdadedesportiva.pt/lances/2954f9b5-f42d-4c6e-a230-6318f0edce34","conclusion":"error","notes":"Record analysis quoted on the incident page."},
      {"source_id":"jorge-faustino-record","tier":"B_EX_REFEREE","url":"https://verdadedesportiva.pt/lances/2954f9b5-f42d-4c6e-a230-6318f0edce34","conclusion":"error","notes":"Record analysis quoted on the incident page."},
      {"source_id":"tiago-antunes-rr","tier":"C_MATCH_EVIDENCE","url":"https://rr.pt/bola-branca/noticia/amp/futebol-nacional/2026/09/05/nota-4-para-joao-pinheiro-penalti-bem-assinalado/484414/","conclusion":"error"},
      {"source_id":"verdade-desportiva","tier":"C_MATCH_EVIDENCE","url":"https://verdadedesportiva.pt/lances/2954f9b5-f42d-4c6e-a230-6318f0edce34","conclusion":"error"}
    ],
    "notes":"Unanimous among the three named analyses captured for this incident.",
    "verified_at":"2026-09-06T23:35:00+01:00"
  }
]